{
  "metadata": {
    "version": "1.0.0",
    "generated_at": "2026-07-08T20:19:02.207405+00:00",
    "year_range": [
      2018,
      2024
    ],
    "n_total": 34079,
    "n_ds3": 18661,
    "n_ds4": 15418,
    "act_disclaimer_es": "Los datos forenses describen la población de casos peritados por Medicina Legal 2018–2024 en cuatro departamentos del Pacífico colombiano. No representan la totalidad de hechos ocurridos. El subregistro estructural es especialmente alto en zonas de difícil acceso."
  },
  "sub_acto_4_1": {
    "title_es": "El universo peritado",
    "anchor_text_es": "34.079 casos peritados por Medicina Legal entre 2018 y 2024 en Cauca, Chocó, Nariño y Valle del Cauca. Más de la mitad de las víctimas son niñas, niños y adolescentes.",
    "stat_cards": [
      {
        "id": "total_cases",
        "label_es": "Total casos peritados",
        "value": 34079,
        "display_format": "integer_thousands",
        "badge": "BOTH",
        "sub_value": null
      },
      {
        "id": "ds3_cases",
        "label_es": "Casos violencia sexual (seforense)",
        "value": 18661,
        "display_format": "integer_thousands",
        "badge": "DS3",
        "sub_value": null
      },
      {
        "id": "ds4_cases",
        "label_es": "Casos violencia física VIF (forense)",
        "value": 15418,
        "display_format": "integer_thousands",
        "badge": "DS4",
        "sub_value": null
      },
      {
        "id": "pct_nna",
        "label_es": "Víctimas NNA (0–17 años)",
        "value": 53.3,
        "display_format": "percent_1d",
        "badge": "BOTH",
        "sub_value": null
      },
      {
        "id": "top_dept_ds3",
        "label_es": "Departamento líder (sexual)",
        "value": "Valle Del Cauca (70.1%)",
        "display_format": "text",
        "badge": "DS3",
        "sub_value": null
      },
      {
        "id": "top_dept_ds4",
        "label_es": "Departamento líder (VIF física)",
        "value": "Valle Del Cauca (62.6%)",
        "display_format": "text",
        "badge": "DS4",
        "sub_value": null
      }
    ]
  },
  "sub_acto_4_2": {
    "title_es": "El hogar como escenario",
    "anchor_text_es": "En más del 77% de los casos peritados, el hecho ocurrió en el hogar. El espacio que debería ser refugio es el escenario más frecuente de la violencia.",
    "aggregation_default": "regional",
    "departments_available": [
      "regional",
      "CAUCA",
      "CHOCO",
      "NARIÑO",
      "VALLE DEL CAUCA"
    ],
    "heatmap_vif": {
      "dataset_id": "ds4_vif",
      "axis_days": [
        "LUNES",
        "MARTES",
        "MIERCOLES",
        "JUEVES",
        "VIERNES",
        "SABADO",
        "DOMINGO"
      ],
      "axis_months": [
        "ENERO",
        "FEBRERO",
        "MARZO",
        "ABRIL",
        "MAYO",
        "JUNIO",
        "JULIO",
        "AGOSTO",
        "SEPTIEMBRE",
        "OCTUBRE",
        "NOVIEMBRE",
        "DICIEMBRE"
      ],
      "by_department": {
        "regional": {
          "matrix": [
            [
              144,
              126,
              121,
              110,
              122,
              135,
              132,
              132,
              130,
              132,
              114,
              129
            ],
            [
              150,
              123,
              111,
              112,
              123,
              102,
              101,
              112,
              109,
              116,
              88,
              84
            ],
            [
              128,
              128,
              118,
              91,
              118,
              108,
              105,
              109,
              96,
              97,
              83,
              88
            ],
            [
              113,
              112,
              111,
              120,
              111,
              98,
              91,
              119,
              85,
              115,
              92,
              77
            ],
            [
              92,
              117,
              87,
              75,
              99,
              99,
              94,
              94,
              92,
              90,
              86,
              72
            ],
            [
              109,
              125,
              120,
              109,
              91,
              95,
              102,
              102,
              96,
              112,
              93,
              89
            ],
            [
              138,
              166,
              208,
              164,
              147,
              148,
              158,
              130,
              216,
              153,
              146,
              152
            ]
          ],
          "total_cases": 9637,
          "peak": {
            "day": "DOMINGO",
            "month": "SEPTIEMBRE",
            "value": 216
          },
          "caveat_es": null
        },
        "CAUCA": {
          "matrix": [
            [
              29,
              30,
              25,
              10,
              27,
              19,
              16,
              34,
              33,
              23,
              23,
              33
            ],
            [
              28,
              30,
              25,
              19,
              24,
              21,
              15,
              23,
              13,
              22,
              18,
              17
            ],
            [
              41,
              29,
              24,
              16,
              27,
              22,
              14,
              17,
              16,
              18,
              17,
              14
            ],
            [
              21,
              22,
              24,
              21,
              20,
              16,
              21,
              16,
              10,
              22,
              15,
              16
            ],
            [
              11,
              29,
              18,
              18,
              18,
              19,
              13,
              23,
              14,
              16,
              21,
              15
            ],
            [
              15,
              17,
              20,
              27,
              14,
              12,
              14,
              16,
              14,
              21,
              17,
              15
            ],
            [
              30,
              42,
              40,
              36,
              24,
              33,
              33,
              20,
              46,
              25,
              25,
              33
            ]
          ],
          "total_cases": 1840,
          "peak": {
            "day": "DOMINGO",
            "month": "SEPTIEMBRE",
            "value": 46
          },
          "caveat_es": null
        },
        "CHOCO": {
          "matrix": [
            [
              2,
              2,
              1,
              3,
              2,
              1,
              1,
              6,
              7,
              2,
              4,
              2
            ],
            [
              2,
              3,
              2,
              2,
              1,
              1,
              2,
              4,
              4,
              4,
              6,
              2
            ],
            [
              2,
              4,
              2,
              1,
              4,
              1,
              0,
              4,
              0,
              2,
              5,
              0
            ],
            [
              4,
              2,
              3,
              1,
              0,
              3,
              2,
              3,
              4,
              1,
              2,
              1
            ],
            [
              3,
              6,
              2,
              1,
              1,
              2,
              2,
              4,
              0,
              3,
              0,
              2
            ],
            [
              1,
              2,
              2,
              0,
              0,
              2,
              5,
              0,
              1,
              1,
              3,
              5
            ],
            [
              4,
              2,
              2,
              2,
              5,
              1,
              5,
              4,
              12,
              3,
              5,
              3
            ]
          ],
          "total_cases": 213,
          "peak": {
            "day": "DOMINGO",
            "month": "SEPTIEMBRE",
            "value": 12
          },
          "caveat_es": "PROVISIONAL: n=213 casos, insuficiente para conclusiones robustas sobre patrones temporales. El bajo volumen puede reflejar subregistro de acceso a medicina legal en zonas rurales del departamento."
        },
        "NARIÑO": {
          "matrix": [
            [
              22,
              19,
              14,
              18,
              18,
              24,
              20,
              13,
              25,
              18,
              21,
              7
            ],
            [
              32,
              24,
              21,
              14,
              25,
              5,
              21,
              9,
              27,
              16,
              15,
              12
            ],
            [
              15,
              21,
              15,
              21,
              24,
              14,
              25,
              27,
              12,
              15,
              8,
              21
            ],
            [
              16,
              16,
              28,
              15,
              21,
              13,
              12,
              24,
              22,
              20,